user_input,retrieved_contexts,response,reference,context_precision,context_recall,faithfulness,answer_relevancy
Who is Alduin?,"['was dubbed the “World Eater,” and some accounts even have him\ndevouring the souls of the dead to maintain his own power. Other stories\nrevolve around Alduin acting as some sort of dragon king, uniting the\nother dragons in a war against mankind, until he was eventually defeated\nat the hands of one or more brave heroes.\nIt is hard to deny that such legends are compelling. But as both High Priest\nand scholar, I am forced to ask that most important of questions - where is\nthe evidence?', 'seem to view Akatosh in much the same way I do - he is, in fact, the Great\nDragon. First among the Divines, perseverance personified and, more than\nanything, a force of supreme good in the world.\nAlduin, they claim, is something altogether different.\nWhether or not he is actually a deity remains in question, but the Alduin of\nNord folklore is in fact a dragon, but one so ancient, and so powerful, he\nwas dubbed the “World Eater,” and some accounts even have him', 'every nation on great Nirn that has embraced the virtues of learning and\nletters), the Great Dragon is worshipped. Usually, the highest of Divines is\nreferred to as Akatosh. But what some may not be aware of is that he is\noccasionally referred to by two other names as well.\nThe Aldmer refer to Akatosh as Auri-El. The Nords call him Alduin.\nThese names come up repeatedly in certain ancient texts, and in each one,\nit is clear that the deity in question is none other than he whom we call\nAkatosh.', 'Book 1:\nThe Alduin/Akatosh Dichotomy\nby Alexandre Simon\nAs High Priest of the Akatosh Chantry, I have dedicated my life to the\nservice of the Great Dragon. He who was first at the Beginning. He who is\ngreatest and most powerful of all the Divines. He who is the very\nembodiment of infinity.\nI am, quite obviously, a man of deep and unwavering faith. But not blind\nfaith, for I am also a man of scholarly endeavors, and have always valued']","Alduin is a powerful dragon from Nord folklore, often referred to as the ""World Eater,"" who is believed to devour the souls of the dead to maintain his power. He is sometimes associated with the deity Akatosh, known as the Great Dragon.",Alduin is a Dragon,0.49999999995,1.0,1.0,0.945153848354947
Who is High Priest?,"['Book 1:\nThe Alduin/Akatosh Dichotomy\nby Alexandre Simon\nAs High Priest of the Akatosh Chantry, I have dedicated my life to the\nservice of the Great Dragon. He who was first at the Beginning. He who is\ngreatest and most powerful of all the Divines. He who is the very\nembodiment of infinity.\nI am, quite obviously, a man of deep and unwavering faith. But not blind\nfaith, for I am also a man of scholarly endeavors, and have always valued', '“Why have you disturbed me?”\nSurprised, the first among them prayed:\n“O Boethiah, Prince of Plots, Deceiver of Nations, Queen of Shadows,\nGoddess of Destruction, we come to worship thee!”\nShe looked down upon her followers, gathered to bear witness. Frowning\nshe asked the first:\n“Tell me, you who profess to know me, how shall I know you?”\nAfeared he exclaimed:\n“Each night I pray to thee, each night I call out thy wondrous names.', 'was dubbed the “World Eater,” and some accounts even have him\ndevouring the souls of the dead to maintain his own power. Other stories\nrevolve around Alduin acting as some sort of dragon king, uniting the\nother dragons in a war against mankind, until he was eventually defeated\nat the hands of one or more brave heroes.\nIt is hard to deny that such legends are compelling. But as both High Priest\nand scholar, I am forced to ask that most important of questions - where is\nthe evidence?', 'every nation on great Nirn that has embraced the virtues of learning and\nletters), the Great Dragon is worshipped. Usually, the highest of Divines is\nreferred to as Akatosh. But what some may not be aware of is that he is\noccasionally referred to by two other names as well.\nThe Aldmer refer to Akatosh as Auri-El. The Nords call him Alduin.\nThese names come up repeatedly in certain ancient texts, and in each one,\nit is clear that the deity in question is none other than he whom we call\nAkatosh.']","The High Priest is a man of deep faith and scholarly endeavors dedicated to the service of Akatosh, the Great Dragon. This character is involved in the Akatosh Chantry and seeks evidence to support the legends surrounding the deity.",Alexandre Simon is the High Priest Author of the book,0.9999999999,0.0,1.0,0.8905208843387721
Who is Alini,"['involved in any number of scandalous activities. How then is an educated,\nenlightened person possibly supposed to believe a legend that has been\npassed down, by word of mouth only, for hundreds, or even thousands of\nyears?\nThe answer to such a question is simple - he cannot.\nAnd so, it is my conclusion that the Alduin of Nord legend is in fact\nmighty Akatosh, whose story grew twisted and deformed through\ncenturies of retelling and embellishment. Through no real fault of their', 'at all.\nMany Altmer of Summerset Isle worship Auri-El, who is the soul of\nAnui-El, who in turn is the soul of Anu the Everything. But if you ask the\nhigh elves themselves (as I did, when I traveled to Summerset Isle to\ncontinue my research), the majority will concede that Auri-El is but\nAkatosh with a different name, colored by their own cultural beliefs.\nSo maybe it comes as no surprise that the real theological dissention lies in\nSkyrim, among the Nord people - renowned as much for their', 'seem to view Akatosh in much the same way I do - he is, in fact, the Great\nDragon. First among the Divines, perseverance personified and, more than\nanything, a force of supreme good in the world.\nAlduin, they claim, is something altogether different.\nWhether or not he is actually a deity remains in question, but the Alduin of\nNord folklore is in fact a dragon, but one so ancient, and so powerful, he\nwas dubbed the “World Eater,” and some accounts even have him', 'Our goal is to cut the cancer death rate by at least 50% over the next 25 years. Turn more cancers from death sentences into treatable diseases. And provide more support for patients and families.\n\nIt’s personal for so many of us.\n\nJoining us are Maurice and Kandice, an Irishman and a daughter of immigrants from Panama.\n\nThey met and fell in love in New York City and got married in the same chapel as Jill and I did.\n\nKindred spirits.\n\nHe wrote us a letter about their little daughter Ava.']",I don't know.,Alini is unknown,0.0,0.0,0.0,0.0
